image_file,result,Visual Elements,Symbolic Significance,Overall Tone
image_ (18).jpg,"<IMAGE_ANALYSIS>
Visual Elements: The image shows a small dog wearing a green and blue Fanta soda bottle around its back, with the brand name prominently displayed. The dog is in a cozy indoor setting, sitting on a bed with a brown headboard and a lamp in the background.

Symbolic Significance: The dog wearing a Fanta bottle is a humorous and creative way to anthropomorphize the dog, making it appear as if it is enjoying the beverage. This could symbolize the dog's playful nature or its fondness for soda.

Overall Tone: The tone of the image is lighthearted and playful, with a focus on the dog's amusing appearance. It conveys a sense of fun and creativity.
</IMAGE_ANALYSIS>"," The image shows a small dog wearing a green and blue Fanta soda bottle around its back, with the brand name prominently displayed. The dog is in a cozy indoor setting, sitting on a bed with a brown headboard and a lamp in the background."," The dog wearing a Fanta bottle is a humorous and creative way to anthropomorphize the dog, making it appear as if it is enjoying the beverage. This could symbolize the dog's playful nature or its fondness for soda."," The tone of the image is lighthearted and playful, with a focus on the dog's amusing appearance. It conveys a sense of fun and creativity."
image_ (1888).jpg,"<IMAGE_ANALYSIS>
Visual Elements : The image shows a young person sitting at a table in a dimly lit restaurant, holding a small object in their right hand and pointing to it with their left hand. The background is dark, with faint lights and other patrons visible.
Symbolic Significance : The text overlay reads ""THIS IS AN OLIVE"" in bold white font, with the image of the object being pointed to. This is a humorous or exaggerated statement, likely meant to be a joke.
Overall Tone : Lighthearted and playful, with a focus on humor and absurdity.
</IMAGE_ANALYSIS>"," The image shows a young person sitting at a table in a dimly lit restaurant, holding a small object in their right hand and pointing to it with their left hand. The background is dark, with faint lights and other patrons visible."," The text overlay reads ""THIS IS AN OLIVE"" in bold white font, with the image of the object being pointed to. This is a humorous or exaggerated statement, likely meant to be a joke."," Lighthearted and playful, with a focus on humor and absurdity."
image_ (19).jpg,"<IMAGE_ANALYSIS>
Visual Elements: A woman holding a small dachshund in a field, with hay bales and a cloudy sky in the background.
Symbolic Significance: The text reads, ""If life is a cookie, dogs are the chocolate chips!"" This suggests a playful and lighthearted interpretation of the relationship between humans and dogs, emphasizing their companionship as essential and enjoyable parts of life.
Overall Tone: Cheerful and optimistic, with a touch of humor.
</IMAGE_ANALYSIS>"," A woman holding a small dachshund in a field, with hay bales and a cloudy sky in the background."," The text reads, ""If life is a cookie, dogs are the chocolate chips!"" This suggests a playful and lighthearted interpretation of the relationship between humans and dogs, emphasizing their companionship as essential and enjoyable parts of life."," Cheerful and optimistic, with a touch of humor."
image_ (1910).jpg,"<IMAGE_ANALYSIS>
Visual Elements : The image features a character with long, disheveled hair and a serious expression, paired with the text overlay ""What can men do against such cheekless hate?"" The top text reads, ""WHEN THE COMMENT SECTION OF A POLITICAL MEME IS HEATING UP.""
Symbolic Significance : The image is a meme that combines a dramatic quote with a humorous or sarcastic commentary on online political discourse. The character's serious expression contrasts with the lighthearted tone of the quote, amplifying the humor.
Overall Tone : The tone is sarcastic and critical, reflecting on the perceived lack of action or moral outrage from some users in political discussions.
</IMAGE_ANALYSIS>"," The image features a character with long, disheveled hair and a serious expression, paired with the text overlay ""What can men do against such cheekless hate?"" The top text reads, ""WHEN THE COMMENT SECTION OF A POLITICAL MEME IS HEATING UP."""," The image is a meme that combines a dramatic quote with a humorous or sarcastic commentary on online political discourse. The character's serious expression contrasts with the lighthearted tone of the quote, amplifying the humor."," The tone is sarcastic and critical, reflecting on the perceived lack of action or moral outrage from some users in political discussions."
image_ (1930).jpg,"<IMAGE_ANALYSIS>
Visual Elements : The image is divided into two sections. On the left, there is a scene from a fantasy film featuring a character with long blonde hair and a serious expression, with a hand gesturing near their face. On the right, a man in a suit is leaning against a wall, looking contemplative or slightly distressed.

Symbolic Significance : The left image appears to be a fantasy or epic scene, possibly from a movie or book, with the character's expression suggesting a moment of deep thought or conflict. The right image shows a man in a formal setting, possibly a professional or serious context, with a contemplative or pensive expression.

Overall Tone : The juxtaposition of the two images creates a contrast between the intense, dramatic fantasy scene on the left and the more subdued, serious tone on the right. It may suggest a narrative or thematic shift between the two characters or scenes.
</IMAGE_ANALYSIS>"," The image is divided into two sections. On the left, there is a scene from a fantasy film featuring a character with long blonde hair and a serious expression, with a hand gesturing near their face. On the right, a man in a suit is leaning against a wall, looking contemplative or slightly distressed."," The left image appears to be a fantasy or epic scene, possibly from a movie or book, with the character's expression suggesting a moment of deep thought or conflict. The right image shows a man in a formal setting, possibly a professional or serious context, with a contemplative or pensive expression."," The juxtaposition of the two images creates a contrast between the intense, dramatic fantasy scene on the left and the more subdued, serious tone on the right. It may suggest a narrative or thematic shift between the two characters or scenes."
image_ (20).jpg,"<IMAGE_ANALYSIS>
Visual Elements: The image shows a cute, fluffy puppy clinging to a bamboo stalk, with a stone wall in the background. The puppy's expression appears curious and slightly mischievous.

Symbolic Significance: The text overlay reads, ""THEY SAID I COULD BE ANYTHING SO I BECAME A PANDA."" This is a humorous play on the idea of self-perception and transformation, using the concept of a panda as a metaphor for someone who has achieved unexpected success or fame.

Overall Tone: The tone is lighthearted and playful, combining the adorable nature of the puppy with the clever and humorous text.
</IMAGE_ANALYSIS>"," The image shows a cute, fluffy puppy clinging to a bamboo stalk, with a stone wall in the background. The puppy's expression appears curious and slightly mischievous."," The text overlay reads, ""THEY SAID I COULD BE ANYTHING SO I BECAME A PANDA."" This is a humorous play on the idea of self-perception and transformation, using the concept of a panda as a metaphor for someone who has achieved unexpected success or fame."," The tone is lighthearted and playful, combining the adorable nature of the puppy with the clever and humorous text."
image_ (21).jpg,"<IMAGE_ANALYSIS>
Visual Elements : The image features a taco with a dog's face superimposed on it. The background is a starry space scene.
Symbolic Significance : This image combines elements of internet culture and humor. The dog's face, often associated with the ""Doge"" meme, is placed on a taco, which is a popular food item in internet memes. The starry background adds a surreal, cosmic twist, enhancing the humor.
Overall Tone : Playful and humorous, blending internet culture with a whimsical, space-themed twist.
</IMAGE_ANALYSIS>", The image features a taco with a dog's face superimposed on it. The background is a starry space scene.," This image combines elements of internet culture and humor. The dog's face, often associated with the ""Doge"" meme, is placed on a taco, which is a popular food item in internet memes. The starry background adds a surreal, cosmic twist, enhancing the humor."," Playful and humorous, blending internet culture with a whimsical, space-themed twist."
image_ (2116).jpg,"<IMAGE_ANALYSIS>
Visual Elements: The image features a man in a suit with a surprised or emphatic expression, gesturing with his hands. The background is plain white.
Symbolic Significance: The text overlay reads: ""OK, LETS MAKE A DEAL. ACCEPT ALL BAD LUCK BRIAN MEME U GET 900 $.” This is a humorous meme format combining a well-known meme format with a dramatic tone.
Overall Tone: The tone is humorous and exaggerated, with the man's expression and gesture suggesting a dramatic or comedic negotiation.
</IMAGE_ANALYSIS>"," The image features a man in a suit with a surprised or emphatic expression, gesturing with his hands. The background is plain white."," The text overlay reads ""OK, LETS MAKE A DEAL. ACCEPT ALL BAD LUCK BRIAN MEME U GET 900 $.” This is a humorous meme format combining a well-known meme format with a dramatic tone."," The tone is humorous and exaggerated, with the man's expression and gesture suggesting a dramatic or comedic negotiation."
image_ (216).jpg,"<IMAGE_ANALYSIS>
Visual Elements: The image depicts a stylized, anthropomorphic emoji with a yellow-orange color, a human-like face, and a mischievous expression. The emoji has a small tuft of hair on its head and is standing with one leg raised and the other bent, giving it a confident or playful stance.

Symbolic Significance: This emoji is likely a humorous or exaggerated representation of a character from a popular animated film or series. Its exaggerated features and pose suggest it is meant to convey a playful or sarcastic tone.

Overall Tone: The tone of the image is lighthearted and humorous, with an undertone of mischief or confidence.
</IMAGE_ANALYSIS>"," The image depicts a stylized, anthropomorphic emoji with a yellow-orange color, a human-like face, and a mischievous expression. The emoji has a small tuft of hair on its head and is standing with one leg raised and the other bent, giving it a confident or playful stance.", This emoji is likely a humorous or exaggerated representation of a character from a popular animated film or series. Its exaggerated features and pose suggest it is meant to convey a playful or sarcastic tone.," The tone of the image is lighthearted and humorous, with an undertone of mischief or confidence."
image_ (226).jpg,"<IMAGE_ANALYSIS>
Visual Elements: The image shows a small dog with a fluffy mane of fur sitting on a green object, possibly a flower pot or a decorative item. The dog appears to be looking relaxed or content.
Symbolic Significance: The text ""DUDE, LOOK... I'M FLOWERS"" is overlaid on the image. This is a pun, as the dog is humorously referred to as ""flowers"" due to its fluffy appearance.
Overall Tone: The tone is lighthearted and playful, combining humor with a cute image of the dog.
</IMAGE_ANALYSIS>"," The image shows a small dog with a fluffy mane of fur sitting on a green object, possibly a flower pot or a decorative item. The dog appears to be looking relaxed or content."," The text ""DUDE, LOOK... I'M FLOWERS"" is overlaid on the image. This is a pun, as the dog is humorously referred to as ""flowers"" due to its fluffy appearance."," The tone is lighthearted and playful, combining humor with a cute image of the dog."
image_ (2265).jpg,"<IMAGE_ANALYSIS>
Visual Elements: The image shows three men standing together, smiling, and wearing black bowler hats. They appear to be in a casual setting, possibly a café or a similar establishment. The background includes a window and some indoor lighting.

Symbolic Significance: The text above the image reads, ""Captain Picard, Sprock and Gandalf walk into a bar..."" This suggests a humorous or fictional scenario involving well-known characters from popular media. The men's attire and the setting imply a relaxed, friendly atmosphere.

Overall Tone: The tone of the image is lighthearted and playful, combining humor with a sense of camaraderie among the individuals.
</IMAGE_ANALYSIS>"," The image shows three men standing together, smiling, and wearing black bowler hats. They appear to be in a casual setting, possibly a café or a similar establishment. The background includes a window and some indoor lighting."," The text above the image reads, ""Captain Picard, Sprock and Gandalf walk into a bar..."" This suggests a humorous or fictional scenario involving well-known characters from popular media. The men's attire and the setting imply a relaxed, friendly atmosphere."," The tone of the image is lighthearted and playful, combining humor with a sense of camaraderie among the individuals."
image_ (227).jpg,"<IMAGE_ANALYSIS>
Visual Elements: The image shows a young wolf puppy standing in a field of purple flowers, looking up with an expression of awe or wonder.
Symbolic Significance: The text overlay reads, ""YOU CAN'T SEE ME I'M A FLOWER."" This is a play on words, combining the literal meaning of ""flower"" with the figurative meaning of ""puppy."" The puppy's innocent and curious expression enhances the humor of the phrase.
Overall Tone: The tone is lighthearted and whimsical, with a touch of humor.
</IMAGE_ANALYSIS>"," The image shows a young wolf puppy standing in a field of purple flowers, looking up with an expression of awe or wonder."," The text overlay reads, ""YOU CAN'T SEE ME I'M A FLOWER."" This is a play on words, combining the literal meaning of ""flower"" with the figurative meaning of ""puppy."" The puppy's innocent and curious expression enhances the humor of the phrase."," The tone is lighthearted and whimsical, with a touch of humor."
image_ (2293).jpg,"<IMAGE_ANALYSIS>
Visual Elements: The image shows a person wearing a suit and speaking into a microphone, with a speech bubble above their head containing the text ""TO MEME OR NOT TO MEME?"" The background features a blue backdrop with the European Union flag and the words ""EU SUMMIT.""

Symbolic Significance: The speech bubble humorously references the internet culture of memes, a form of internet humor that often involves wordplay or absurd scenarios. The phrase ""to meme or not to meme"" is a playful jab at the culture surrounding memes.

Overall Tone: The tone is lighthearted and humorous, poking fun at the internet's obsession with memes.
</IMAGE_ANALYSIS>"," The image shows a person wearing a suit and speaking into a microphone, with a speech bubble above their head containing the text ""TO MEME OR NOT TO MEME?"" The background features a blue backdrop with the European Union flag and the words ""EU SUMMIT."""," The speech bubble humorously references the internet culture of memes, a form of internet humor that often involves wordplay or absurd scenarios. The phrase ""to meme or not to meme"" is a playful jab at the culture surrounding memes."," The tone is lighthearted and humorous, poking fun at the internet's obsession with memes."
image_ (2315).jpg,"<IMAGE_ANALYSIS>
    Visual Elements : The image is divided into two sections. The top section features two young women, with text overlay that reads, ""just giving things that one best friend that you do everything with."" The bottom section shows two men, one in a formal suit and the other in a military uniform, standing in front of a marching band.

Symbolic Significance : The top section suggests a close, supportive relationship, while the bottom section represents a formal or official setting, possibly a military or state event. The juxtaposition implies a contrast between personal and professional relationships.

Overall Tone : The tone is a mix of warmth and formality, with the top section conveying a sense of friendship and the bottom section suggesting a formal, official context.
</IMAGE_ANALYSIS>"," The image is divided into two sections. The top section features two young women, with text overlay that reads, ""just giving things that one best friend that you do everything with."" The bottom section shows two men, one in a formal suit and the other in a military uniform, standing in front of a marching band."," The top section suggests a close, supportive relationship, while the bottom section represents a formal or official setting, possibly a military or state event. The juxtaposition implies a contrast between personal and professional relationships."," The tone is a mix of warmth and formality, with the top section conveying a sense of friendship and the bottom section suggesting a formal, official context."
image_ (2418).jpg,"<IMAGE_ANALYSIS>

Visual Elements:
- The scene is set outdoors with a rural or countryside backdrop, featuring a yellow airplane and a truck in the background.
- The characters are casually dressed, with some wearing sunglasses, suggesting a relaxed or informal setting.
- The dialogue is in natural, conversational English.

Symbolic Significance:
- The conversation revolves around the cost of hiring a ""Kiló"" (a slang term for a person or service) for $2,000 per kiló.
- The question ""How much is a kiló?"" is a rhetorical question, likely meant to provoke thought or humor.
- The response ""2.2 pounds, Mr. Seall"" is a humorous twist, as kiló is a unit of weight, and the term ""kiló"" is used in slang to refer to a person or service.

Overall Tone:
- The tone is lighthearted and humorous, with a touch of absurdity. The use of slang and informal language adds to the comedic effect.
</IMAGE_ANALYSIS>","
- The scene is set outdoors with a rural or countryside backdrop, featuring a yellow airplane and a truck in the background.
- The characters are casually dressed, with some wearing sunglasses, suggesting a relaxed or informal setting.
- The dialogue is in natural, conversational English.","
- The conversation revolves around the cost of hiring a ""Kiló"" (a slang term for a person or service) for $2,000 per kiló.
- The question ""How much is a kiló?"" is a rhetorical question, likely meant to provoke thought or humor.
- The response ""2.2 pounds, Mr. Seall"" is a humorous twist, as kiló is a unit of weight, and the term ""kiló"" is used in slang to refer to a person or service.","
- The tone is lighthearted and humorous, with a touch of absurdity. The use of slang and informal language adds to the comedic effect."
image_ (2419).jpg,"<IMAGE_ANALYSIS>
Visual Elements: The image shows a dog standing on a staircase, with a lamp and a picture of the same dog in the background. The text overlay reads: ""IT'S BEDTIME ARE YOU COMING OR NOT?""
Symbolic Significance: The dog on the staircase is humorously depicted as if it is about to ""fall,"" creating a playful and exaggerated visual metaphor for the text. The image plays on the idea of urgency, as if the dog is warning the viewer to hurry or leave before it ""falls.""
Overall Tone: The tone is humorous and lighthearted, with a touch of absurdity due to the dog's position on the stairs.
</IMAGE_ANALYSIS>"," The image shows a dog standing on a staircase, with a lamp and a picture of the same dog in the background. The text overlay reads ""IT'S BEDTIME ARE YOU COMING OR NOT?"""," The dog on the staircase is humorously depicted as if it is about to ""fall,"" creating a playful and exaggerated visual metaphor for the text. The image plays on the idea of urgency, as if the dog is warning the viewer to hurry or leave before it ""falls."""," The tone is humorous and lighthearted, with a touch of absurdity due to the dog's position on the stairs."
image_ (243).jpg,"<IMAGE_ANALYSIS>
Visual Elements : The image features a light-colored background with a quote in black and pink text. The quote reads: ""Life is the flower for which love is the honey."" A small bee illustration is positioned to the right of the text, symbolizing the honey.

Symbolic Significance : The quote suggests that life is like a flower, and love is the nectar or honey that makes it beautiful. The bee represents the source of the honey, emphasizing the importance of love in nurturing life.

Overall Tone : The tone is gentle, inspirational, and poetic, aiming to evoke feelings of appreciation and joy.
</IMAGE_ANALYSIS>"," The image features a light-colored background with a quote in black and pink text. The quote reads ""Life is the flower for which love is the honey."" A small bee illustration is positioned to the right of the text, symbolizing the honey."," The quote suggests that life is like a flower, and love is the nectar or honey that makes it beautiful. The bee represents the source of the honey, emphasizing the importance of love in nurturing life."," The tone is gentle, inspirational, and poetic, aiming to evoke feelings of appreciation and joy."
image_ (2487).jpg,"<IMAGE_ANALYSIS>
Visual Elements: The image shows a man in a suit sitting at a desk, with a blurred cityscape in the background. He appears to be in a professional setting, possibly an office.
Symbolic Significance: The text overlay reads, ""Harvey Specter, I'm sorry, what language are you speaking? It sounds like bullshit."" This is a quote from the TV show The Big Bang Theory, where the character Harvey Specter is addressing someone in a sarcastic tone.
Overall Tone: The tone is sarcastic and critical, reflecting Harvey Specter's sarcastic and often harsh personality.
</IMAGE_ANALYSIS>"," The image shows a man in a suit sitting at a desk, with a blurred cityscape in the background. He appears to be in a professional setting, possibly an office."," The text overlay reads, ""Harvey Specter, I'm sorry, what language are you speaking? It sounds like bullshit."" This is a quote from the TV show The Big Bang Theory, where the character Harvey Specter is addressing someone in a sarcastic tone."," The tone is sarcastic and critical, reflecting Harvey Specter's sarcastic and often harsh personality."
image_ (251).jpg,"<IMAGE_ANALYSIS>
Visual Elements: The image depicts a small, adorable cat wearing a green hoodie with frog-like ears. The cat has large, expressive eyes and a soft, fluffy texture.

Symbolic Significance: The green hoodie with frog ears suggests a playful or whimsical theme, possibly inspired by nature or fantasy. The cat's expression appears curious and gentle, adding to the charm of the image.

Overall Tone: The tone of the image is lighthearted and whimsical, with a focus on cuteness and humor.
</IMAGE_ANALYSIS>"," The image depicts a small, adorable cat wearing a green hoodie with frog-like ears. The cat has large, expressive eyes and a soft, fluffy texture."," The green hoodie with frog ears suggests a playful or whimsical theme, possibly inspired by nature or fantasy. The cat's expression appears curious and gentle, adding to the charm of the image."," The tone of the image is lighthearted and whimsical, with a focus on cuteness and humor."
image_ (254).jpg,"<IMAGE_ANALYSIS>
Visual Elements: The image depicts a green-skinned figure resembling a well-known meme character, dressed in a dark blue shirt and holding a rifle. The figure is standing next to an American flag, which is slightly tilted. The character is wearing sunglasses and has a confident expression.

Symbolic Significance: The figure is a parody of a well-known political meme character, often associated with controversial or satirical political commentary. The rifle and the American flag suggest themes of patriotism, militarism, or political rhetoric.

Overall Tone: The tone of the image is satirical and political, likely intended to critique or mock political figures or ideologies. It uses exaggerated imagery to convey a message that is critical or critical of the subject.
</IMAGE_ANALYSIS>"," The image depicts a green-skinned figure resembling a well-known meme character, dressed in a dark blue shirt and holding a rifle. The figure is standing next to an American flag, which is slightly tilted. The character is wearing sunglasses and has a confident expression."," The figure is a parody of a well-known political meme character, often associated with controversial or satirical political commentary. The rifle and the American flag suggest themes of patriotism, militarism, or political rhetoric."," The tone of the image is satirical and political, likely intended to critique or mock political figures or ideologies. It uses exaggerated imagery to convey a message that is critical or critical of the subject."
