image_file,result,Visual Elements,Symbolic Significance,Overall Tone
image_ (419).jpg,"<IMAGE_ANALYSIS>
Visual Elements: A lemon is placed on wheels, resembling a small vehicle. The lemon's shape and texture contrast with the wheels, creating a whimsical and humorous effect.
Symbolic Significance: This image likely symbolizes the concept of ""lemon-powered"" vehicles, which could be a playful representation of innovation or creativity. The lemon, a common fruit, is juxtaposed with wheels, suggesting a fusion of nature and technology.
Overall Tone: The tone is lighthearted and imaginative, blending humor with a creative twist.
</IMAGE_ANALYSIS>"," A lemon is placed on wheels, resembling a small vehicle. The lemon's shape and texture contrast with the wheels, creating a whimsical and humorous effect."," This image likely symbolizes the concept of ""lemon-powered"" vehicles, which could be a playful representation of innovation or creativity. The lemon, a common fruit, is juxtaposed with wheels, suggesting a fusion of nature and technology."," The tone is lighthearted and imaginative, blending humor with a creative twist."
image_ (441).jpg,"<IMAGE_ANALYSIS>
Visual Elements: A green dumpster labeled ""YOUR OPINION"" is filled with black garbage bags, all of which are on fire. Two additional black garbage bags are placed outside the dumpster.
Symbolic Significance: The image symbolizes the burning of one's own opinion, suggesting that opinions are often discarded or destroyed. The dumpster represents the disposal of thoughts, and the fire represents the destruction of these ideas.
Overall Tone: The tone is critical and satirical, implying that opinions are often dismissed or discarded, much like garbage.
</IMAGE_ANALYSIS>"," A green dumpster labeled ""YOUR OPINION"" is filled with black garbage bags, all of which are on fire. Two additional black garbage bags are placed outside the dumpster."," The image symbolizes the burning of one's own opinion, suggesting that opinions are often discarded or destroyed. The dumpster represents the disposal of thoughts, and the fire represents the destruction of these ideas."," The tone is critical and satirical, implying that opinions are often dismissed or discarded, much like garbage."
image_ (448).jpg,"<IMAGE_ANALYSIS>
Visual Elements : The image shows a character from the game PlayerUnknown's Battlegrounds (PUBG) standing in front of a large explosion, with a caption above reading ""PUBG IS TRASH."" The background includes a destroyed urban environment with buildings and a bridge.
Symbolic Significance : The text ""PUBG IS TRASH"" is a humorous commentary on the game's chaotic and violent gameplay, often criticized for its lack of realism and difficulty. The explosion and destruction in the background emphasize the chaotic and destructive nature of the game.
Overall Tone : The tone is humorous and sarcastic, reflecting the player's frustration with the game's gameplay mechanics.
</IMAGE_ANALYSIS>"," The image shows a character from the game PlayerUnknown's Battlegrounds (PUBG) standing in front of a large explosion, with a caption above reading ""PUBG IS TRASH."" The background includes a destroyed urban environment with buildings and a bridge."," The text ""PUBG IS TRASH"" is a humorous commentary on the game's chaotic and violent gameplay, often criticized for its lack of realism and difficulty. The explosion and destruction in the background emphasize the chaotic and destructive nature of the game."," The tone is humorous and sarcastic, reflecting the player's frustration with the game's gameplay mechanics."
image_ (484).jpg,"<IMAGE_ANALYSIS>
Visual Elements: The image shows a human figure in a posture that suggests pain or discomfort, with a highlighted area on the lower back. The text overlays are bold and centered, written in white font.

Symbolic Significance: The text references a humorous or metaphorical connection between the back pain depicted in the image and the concept of ""a temple."" It suggests that the back is a sacred or important part of the body, akin to a temple. The humor lies in the juxtaposition of the serious image of back pain with the lighthearted and metaphorical interpretation of it as sacred.

Overall Tone: The tone is playful and humorous, blending a serious visual metaphor with a comedic twist.
</IMAGE_ANALYSIS>"," The image shows a human figure in a posture that suggests pain or discomfort, with a highlighted area on the lower back. The text overlays are bold and centered, written in white font."," The text references a humorous or metaphorical connection between the back pain depicted in the image and the concept of ""a temple."" It suggests that the back is a sacred or important part of the body, akin to a temple. The humor lies in the juxtaposition of the serious image of back pain with the lighthearted and metaphorical interpretation of it as sacred."," The tone is playful and humorous, blending a serious visual metaphor with a comedic twist."
image_ (500).jpg,"<IMAGE_ANALYSIS>

Visual Elements:
- A Siamese cat with striking blue eyes is being held by a person.
- The cat appears to be biting or chewing on a slice of bread.
- The background includes a tiled floor and some toys, suggesting a domestic setting.

Symbolic Significance:
- The image humorously juxtaposes the cat's natural instincts (eating) with the human-provided bread, creating a playful and absurd scenario.
- It may symbolize the cat's curiosity or playful behavior, as well as the human-animal bond.

Overall Tone:
- The tone is lighthearted and humorous, as the image combines a cute animal with an unexpected and funny situation.
</IMAGE_ANALYSIS>","
- A Siamese cat with striking blue eyes is being held by a person.
- The cat appears to be biting or chewing on a slice of bread.
- The background includes a tiled floor and some toys, suggesting a domestic setting.","
- The image humorously juxtaposes the cat's natural instincts (eating) with the human-provided bread, creating a playful and absurd scenario.
- It may symbolize the cat's curiosity or playful behavior, as well as the human-animal bond.","
- The tone is lighthearted and humorous, as the image combines a cute animal with an unexpected and funny situation."
image_ (518).jpg,"<IMAGE_ANALYSIS>
Visual Elements: A man standing at the edge of a beach, facing the ocean with his back slightly arched, and a rainbow arching across the sky behind him. The man is shirtless, wearing shorts, and appears to be standing in shallow water.

Symbolic Significance: The rainbow is often associated with hope, joy, and beauty, and its presence in this context could symbolize a moment of triumph or a transformative experience. The man's posture, with his back arched and looking upwards, suggests a sense of awe or reflection.

Overall Tone: The image conveys a sense of wonder and positivity, with the man seemingly experiencing a moment of pure joy or spiritual awakening. The rainbow adds a magical and uplifting element to the scene.
</IMAGE_ANALYSIS>"," A man standing at the edge of a beach, facing the ocean with his back slightly arched, and a rainbow arching across the sky behind him. The man is shirtless, wearing shorts, and appears to be standing in shallow water."," The rainbow is often associated with hope, joy, and beauty, and its presence in this context could symbolize a moment of triumph or a transformative experience. The man's posture, with his back arched and looking upwards, suggests a sense of awe or reflection."," The image conveys a sense of wonder and positivity, with the man seemingly experiencing a moment of pure joy or spiritual awakening. The rainbow adds a magical and uplifting element to the scene."
image_ (527).jpg,"<IMAGE_ANALYSIS>
Visual Elements: A light bulb with a transparent glass casing, inside which a small tree is growing. The tree is lush and green, symbolizing growth and vitality. The background is a gradient of blue, giving a clean and futuristic feel.

Symbolic Significance: This image symbolizes the integration of nature and technology. The light bulb represents innovation and energy, while the tree represents growth, sustainability, and environmental consciousness. Together, they suggest a harmonious balance between innovation and environmental stewardship.

Overall Tone: The tone is optimistic and forward-looking, emphasizing the importance of sustainable practices and the potential for growth in a technologically advanced world.
</IMAGE_ANALYSIS>"," A light bulb with a transparent glass casing, inside which a small tree is growing. The tree is lush and green, symbolizing growth and vitality. The background is a gradient of blue, giving a clean and futuristic feel."," This image symbolizes the integration of nature and technology. The light bulb represents innovation and energy, while the tree represents growth, sustainability, and environmental consciousness. Together, they suggest a harmonious balance between innovation and environmental stewardship."," The tone is optimistic and forward-looking, emphasizing the importance of sustainable practices and the potential for growth in a technologically advanced world."
image_ (56).jpg,"<IMAGE_ANALYSIS>
Visual Elements: The image shows two teddy bears, one larger and one smaller, hugging each other. The larger bear has the text ""me"" written on its chest, while the smaller bear has the text ""you"" written on its chest. Above the bears, there are pink heart emojis floating, symbolizing affection or love.

Symbolic Significance: The image conveys a sense of closeness and affection between two individuals, represented by the teddy bears hugging each other. The text ""me"" and ""you"" suggests a personal connection, likely between two people. The pink heart emojis further emphasize the theme of love and care.

Overall Tone: The tone of the image is warm, affectionate, and sentimental, suggesting a romantic or loving relationship.
</IMAGE_ANALYSIS>"," The image shows two teddy bears, one larger and one smaller, hugging each other. The larger bear has the text ""me"" written on its chest, while the smaller bear has the text ""you"" written on its chest. Above the bears, there are pink heart emojis floating, symbolizing affection or love."," The image conveys a sense of closeness and affection between two individuals, represented by the teddy bears hugging each other. The text ""me"" and ""you"" suggests a personal connection, likely between two people. The pink heart emojis further emphasize the theme of love and care."," The tone of the image is warm, affectionate, and sentimental, suggesting a romantic or loving relationship."
image_ (574).jpg,"<IMAGE_ANALYSIS>
Visual Elements : The image features a rainy scene with green foliage and a cat and a dog. The text overlay reads ""Raining Cats and Dogs.""
Symbolic Significance : The image symbolizes the common experience of rain, which can affect both cats and dogs. It highlights the adaptability of animals to different weather conditions.
Overall Tone : The tone is informative and lighthearted, aiming to educate viewers about the common challenges and joys of living with cats and dogs during rainy weather.
</IMAGE_ANALYSIS>"," The image features a rainy scene with green foliage and a cat and a dog. The text overlay reads ""Raining Cats and Dogs."""," The image symbolizes the common experience of rain, which can affect both cats and dogs. It highlights the adaptability of animals to different weather conditions."," The tone is informative and lighthearted, aiming to educate viewers about the common challenges and joys of living with cats and dogs during rainy weather."
image_ (575).jpg,"<IMAGE_ANALYSIS>

Visual Elements:
- A young boy with red hair is running through a rainy scene, holding a colorful umbrella.
- Surrounding him are several cartoon cats of different colors and sizes, each appearing playful and cheerful.
- The background is a light, rainy sky with gentle rain falling, creating a whimsical atmosphere.

Symbolic Significance:
- The boy represents a child, symbolizing innocence and joy.
- The cats, in their playful forms, symbolize friendship and companionship.
- The umbrella suggests protection and shelter, highlighting the importance of staying safe in the rain.

Overall Tone:
- The image conveys a sense of fun and adventure, with the boy and his playful companions enjoying a rainy day.
- The bright colors and cheerful expressions evoke a sense of happiness and optimism.

</IMAGE_ANALYSIS>","
- A young boy with red hair is running through a rainy scene, holding a colorful umbrella.
- Surrounding him are several cartoon cats of different colors and sizes, each appearing playful and cheerful.
- The background is a light, rainy sky with gentle rain falling, creating a whimsical atmosphere.","
- The boy represents a child, symbolizing innocence and joy.
- The cats, in their playful forms, symbolize friendship and companionship.
- The umbrella suggests protection and shelter, highlighting the importance of staying safe in the rain.","
- The image conveys a sense of fun and adventure, with the boy and his playful companions enjoying a rainy day.
- The bright colors and cheerful expressions evoke a sense of happiness and optimism."
image_ (576).jpg,"<IMAGE_ANALYSIS>

Visual Elements:
- A rainy urban scene with people holding umbrellas.
- Floating cats and dogs in the air, seemingly unaffected by the rain.
- A person in the foreground holding an umbrella, looking concerned.
- Buildings in the background, suggesting a city environment.

Symbolic Significance:
- The floating cats and dogs could symbolize a whimsical or surreal element, blending the ordinary with the extraordinary.
- The rainy scene might represent a moment of stress or chaos, with the floating animals offering a sense of calm or escape.
- The umbrellas and rain suggest a focus on human resilience and adaptation to challenging weather conditions.

Overall Tone:
- The image conveys a sense of whimsy and surrealism, blending the mundane with the fantastical.
- It may also reflect themes of escapism or the ability to find joy even in challenging situations.
</IMAGE_ANALYSIS>","
- A rainy urban scene with people holding umbrellas.
- Floating cats and dogs in the air, seemingly unaffected by the rain.
- A person in the foreground holding an umbrella, looking concerned.
- Buildings in the background, suggesting a city environment.","
- The floating cats and dogs could symbolize a whimsical or surreal element, blending the ordinary with the extraordinary.
- The rainy scene might represent a moment of stress or chaos, with the floating animals offering a sense of calm or escape.
- The umbrellas and rain suggest a focus on human resilience and adaptation to challenging weather conditions.","
- The image conveys a sense of whimsy and surrealism, blending the mundane with the fantastical.
- It may also reflect themes of escapism or the ability to find joy even in challenging situations."
image_ (581).jpg,"<IMAGE_ANALYSIS>
Visual Elements: The image features a simple, clean design with a centered white background and black text. The text reads: ""A promise is a debt."" Below this, the source ""Picture Quotes.com"" is mentioned.

Symbolic Significance: The phrase ""A promise is a debt"" is a metaphorical representation of the consequences of making promises. It suggests that once a promise is made, it becomes a responsibility that must be repaid.

Overall Tone: The tone of the image is serious and reflective, emphasizing the importance of making commitments with integrity.
</IMAGE_ANALYSIS>"," The image features a simple, clean design with a centered white background and black text. The text reads ""A promise is a debt."" Below this, the source ""Picture Quotes.com"" is mentioned."," The phrase ""A promise is a debt"" is a metaphorical representation of the consequences of making promises. It suggests that once a promise is made, it becomes a responsibility that must be repaid."," The tone of the image is serious and reflective, emphasizing the importance of making commitments with integrity."
image_ (582).jpg,"<IMAGE_ANALYSIS>
Visual Elements : The image features a person walking in a surreal landscape with mountains, clouds, and a starry sky. There is a white animal, possibly a wolf, and a circular object resembling a compass or a celestial body in the foreground.

Symbolic Significance : The person walking in a dreamlike, surreal environment suggests a journey or a quest, possibly symbolizing the search for meaning or a new path. The quote emphasizes the importance of taking a ""promise made is a debt unpaid"" journey, which could relate to personal growth, financial responsibility, or self-discovery.

Overall Tone : The tone of the image and the quote is reflective and introspective, encouraging the viewer to embark on a meaningful journey while acknowledging the consequences of their actions.
</IMAGE_ANALYSIS>"," The image features a person walking in a surreal landscape with mountains, clouds, and a starry sky. There is a white animal, possibly a wolf, and a circular object resembling a compass or a celestial body in the foreground."," The person walking in a dreamlike, surreal environment suggests a journey or a quest, possibly symbolizing the search for meaning or a new path. The quote emphasizes the importance of taking a ""promise made is a debt unpaid"" journey, which could relate to personal growth, financial responsibility, or self-discovery."," The tone of the image and the quote is reflective and introspective, encouraging the viewer to embark on a meaningful journey while acknowledging the consequences of their actions."
image_ (612).jpg,"<IMAGE_ANALYSIS>
Visual Elements : A kitten holding a red rose, with the text ""Miss u"" written above it.
Symbolic Significance : The kitten holding the rose conveys affection and a longing for someone, while the text ""Miss u"" suggests a message of missing someone.
Overall Tone : Heartfelt and cute, the image conveys a sense of nostalgia and tenderness.
</IMAGE_ANALYSIS>"," A kitten holding a red rose, with the text ""Miss u"" written above it."," The kitten holding the rose conveys affection and a longing for someone, while the text ""Miss u"" suggests a message of missing someone."," Heartfelt and cute, the image conveys a sense of nostalgia and tenderness."
image_ (614).jpg,"<IMAGE_ANALYSIS>
Visual Elements: The image shows vibrant red roses with water droplets on their petals, set against a lush green background.
Symbolic Significance: The roses symbolize beauty, love, and admiration, while the water droplets suggest freshness and vitality.
Overall Tone: The text ""FOR YOU BEAUTIFUL"" combined with the roses conveys a cheerful and affectionate message, likely intended to express admiration or appreciation.
</IMAGE_ANALYSIS>"," The image shows vibrant red roses with water droplets on their petals, set against a lush green background."," The roses symbolize beauty, love, and admiration, while the water droplets suggest freshness and vitality."," The text ""FOR YOU BEAUTIFUL"" combined with the roses conveys a cheerful and affectionate message, likely intended to express admiration or appreciation."
image_ (616).jpg,"<IMAGE_ANALYSIS>
Visual Elements : A field of yellow dandelions stretching across the foreground, a solitary leafless tree in the middle ground, and a vibrant double rainbow arching across the sky.
Symbolic Significance : The image conveys a sense of hope and resilience, with the rainbow symbolizing hope and the field of dandelions representing growth and renewal. The solitary tree may symbolize endurance or the strength to face challenges.
Overall Tone : The tone is uplifting and hopeful, with a message of perseverance and optimism.
</IMAGE_ANALYSIS>"," A field of yellow dandelions stretching across the foreground, a solitary leafless tree in the middle ground, and a vibrant double rainbow arching across the sky."," The image conveys a sense of hope and resilience, with the rainbow symbolizing hope and the field of dandelions representing growth and renewal. The solitary tree may symbolize endurance or the strength to face challenges."," The tone is uplifting and hopeful, with a message of perseverance and optimism."
image_ (627).jpg,"<IMAGE_ANALYSIS>

Visual Elements : A cigarette with a visible flame at the tip, transitioning into a silhouette of multiple human figures. The figures appear to be progressively smaller as they move from left to right, fading into the smoke. The background is a cloudy sky, suggesting an atmosphere of environmental concern.

Symbolic Significance : The image conveys a message about the environmental impact of smoking, particularly the health risks associated with long-term smoking. The shrinking figures represent the number of people affected by smoking-related diseases, while the cigarette symbolizes the act of smoking itself. The smoky background emphasizes the harmful effects of smoking on the environment.

Overall Tone : The tone is serious and somber, aiming to raise awareness about the dangers of smoking and the environmental toll it has on society.
</IMAGE_ANALYSIS>"," A cigarette with a visible flame at the tip, transitioning into a silhouette of multiple human figures. The figures appear to be progressively smaller as they move from left to right, fading into the smoke. The background is a cloudy sky, suggesting an atmosphere of environmental concern."," The image conveys a message about the environmental impact of smoking, particularly the health risks associated with long-term smoking. The shrinking figures represent the number of people affected by smoking-related diseases, while the cigarette symbolizes the act of smoking itself. The smoky background emphasizes the harmful effects of smoking on the environment."," The tone is serious and somber, aiming to raise awareness about the dangers of smoking and the environmental toll it has on society."
image_ (628).jpg,"<IMAGE_ANALYSIS>
Visual Elements: A hand holding a red container shaped like a French fry, with several cigarettes placed inside. The container has a golden ""M"" logo on it, resembling the McDonald's logo.
Symbolic Significance: This image humorously juxtaposes the fast-food brand McDonald's with the imagery of cigarettes, creating a satirical or ironic commentary on consumerism and lifestyle choices.
Overall Tone: The tone is lighthearted and playful, with a hint of critique or satire.
</IMAGE_ANALYSIS>"," A hand holding a red container shaped like a French fry, with several cigarettes placed inside. The container has a golden ""M"" logo on it, resembling the McDonald's logo."," This image humorously juxtaposes the fast-food brand McDonald's with the imagery of cigarettes, creating a satirical or ironic commentary on consumerism and lifestyle choices."," The tone is lighthearted and playful, with a hint of critique or satire."
image_ (638).jpg,"<IMAGE_ANALYSIS>
Visual Elements: A cat dressed in a police uniform, complete with a hat, gloves, and a badge, standing on a road with a guardrail in the background.
Symbolic Significance: The image humorously anthropomorphizes the cat, giving it a police officer persona, which is likely intended to evoke a playful or absurd reaction from viewers.
Overall Tone: Lighthearted and whimsical, with a focus on the absurdity of the costume.
</IMAGE_ANALYSIS>"," A cat dressed in a police uniform, complete with a hat, gloves, and a badge, standing on a road with a guardrail in the background."," The image humorously anthropomorphizes the cat, giving it a police officer persona, which is likely intended to evoke a playful or absurd reaction from viewers."," Lighthearted and whimsical, with a focus on the absurdity of the costume."
image_ (649).jpg,"<IMAGE_ANALYSIS>
Visual Elements : The image shows a 3D representation of human kidneys, with blood vessels depicted in red and blue, and a smartphone displaying a colorful wallpaper.
Symbolic Significance : The kidneys are shown in a medical context, likely to emphasize their role in the circulatory system. The smartphone represents modern technology and connectivity, suggesting the integration of health and digital communication.
Overall Tone : The tone is informative and modern, blending medical education with technological advancement.
</IMAGE_ANALYSIS>"," The image shows a 3D representation of human kidneys, with blood vessels depicted in red and blue, and a smartphone displaying a colorful wallpaper."," The kidneys are shown in a medical context, likely to emphasize their role in the circulatory system. The smartphone represents modern technology and connectivity, suggesting the integration of health and digital communication."," The tone is informative and modern, blending medical education with technological advancement."
